start,end,text
1921.86,1952.67,"So you know how to update the weights. And that is, let's say, the gradient descent at a much larger scale than things that we have been talking about. So now you can see that the notation already becomes a bit more mathematical. So if you look at the cell, then there are these inputs that are being given. So x0, x1, x2, you can think of that as the output of a previous..."
1952.67,1984.02,"neuron, and this is multiplied with the weights, right? W0, W1, W2. These are summed up, and then a function is being applied to this sum, and that is again the output, right? And I hope that you recognize the things that we also talked about in regression, et cetera, et cetera, right? So this is the same process in the small."
1984.27,2010.9,"What will be confusing, right? And something that was also pointed out in the lecture on regression. Here I start counting with W0, W1, W2. Right? So you have these weights. But there is also this constant B. So here B is listed separately. Right? And then that..."
2010.9,2039.46,"Like in some books that is being done, that's also how you mostly saw it when we talked about regression. So here B is done separately. Also in SVMs, we always had like a constant factor there. And then you take, let's say, the weighted sum of all the other inputs. This is exactly the same as saying that B is equal to W0 times X0."
2039.46,2070.29,"where you make the assumption that this signal has an input of 1. So why am I elaborating on that? In different articles, in different books, you will see different notations. As I said, for SVMs, there was an explicit B. If we go to talking more formal about neural networks, there will not be a B. But there will be a W0 that we assume that this input, this X0, is a constant, is always 1. Yeah?"
2070.42,2098.66,"Just to avoid that you get confused, let's say, later. So we have inputs, we have weights, we have the somebody that is doing the summation, and then we have an activation function. So these are the different ingredients. So then the first attempt at building such a neural network, they would just use one layer, and that is called the perceptron."
2098.66,2127.5,"And the capability of the perceptron are very much similar to, let's say, SVMs and regression type of techniques. And what you will see is that this is not enough. So here we have just one cell. And this is already very powerful. Everything that we were talking about related to regression, et cetera, I can apply here. It's like this, very compact, but it is not enough. And I will show you."
2127.6,2155.07,"an example where this is the case. But before doing this, let's try this to make this a bit more operational. So we have this activation function. There are different inputs, one, two, and one. So as I said, we often assume that the first one has a weight of equal to one, right? So this times this is our B."
2155.07,2183.98,"value in the previous notation. So we just then multiply these things, and this is what comes out of this. So we have a certain output, for example 0.3. If we multiply, so if we take the weighted sum of these inputs, I get 0.3. And then we have this function f that needs to translate this 0.3 into an output."
2184.02,2213.46,"Just think about logistic regression, right? Where we are using the sigmoid function, and in the end we would like to translate things to either true or false. Let's say 1 or 0. And there we typically did, if it was below half, then it would be equal to 0, for example. But we can choose this activation function here. Here again is this comment."
2213.46,2243.95,"to make sure that you don't get confused there. I already mentioned the sigmoid function. So this function f that we saw, like in this lecture, we will typically assume that this function f is the sigmoid function, right? And why do we assume this? Because the sigmoid function has a bunch of very interesting mathematical properties. First of all, whatever the input is,"
2243.95,2272.58,"So I have an input that can range from minus infinity to plus infinity, so basically any number, and I always squeeze it into this interval between 0 and 1. So given a certain x value, it can be plus infinity or minus infinity, we squash it between 0 and 1. That's a nice property. Another very nice property is that if we look at the derivative,"
2272.58,2301.78,"of the sigmoid function, the derivative of this is, let's say, sigmoid x times 1 minus sigmoid x. You have no clue why this is now relevant for you, but if I show you the formulas on Monday, you will realize that we are using this, right? And again, we want to do gradient descent, so if we want to do gradient descent, it is very helpful that our derivative looks very nice."
2301.84,2329.23,"is the same as that we often take the error to the power 2. Why do we do that? Because then the derivative, if you have x to the power 2, the derivative, better I should say better, if I take half times x to the power 2, and I take the derivative of this, it's simply x, right? And that's something that we can easily compute with. So this is what we will actually use."
2329.3,2358.1,"But to do, let's say, pen and paper examples, we typically assume a simpler function, in such a way that we do not have to compute with, let's say, very complicated numbers, where we simply say, if it's below zero, we say zero. If it's above zero, we just say one. So we make it like a function that is easy with pen and paper. Let's now try to implement some logical formulas."
2358.35,2384.82,"So if we look at the OR, this is the truth table where 0 is false and 1 is true. If we look at this true table, then false or false is false. False or true is true. True or false is true. True or true is equal to true. So this is the truth table that you all know."
2384.82,2415.87,"And here what I do is that I create a small, let's say, perceptron. So a very simple neural network that is able to compute this. And I'm using these weights. And I'm using, let's say, this function that I explained on the previous slide to make it very easy. Right? So, and again, for this tiny example, it is evil to write down. So we are now looking at a function that has this shape."
2415.87,2445.23,"So we take the weighted input and note that we are making this assumption W0 times 1 is equal to the B that we had in other expressions. So there is always a 1 here. It doesn't come from the previous layer or it doesn't come from the input. It's fixed. But we have X1 and X2 as output. So that leads to this formula. And F has this shape. So with these weights,"
2445.23,2474.83,"we get this expression. So x1 plus x2 minus half gets a sum. And if the sum is negative, we say false. If the sum is positive, we say it's true. And like if I now draw this line in this two-dimensional place, we are basically saying for these three points, we say true. And for this point, we say false. So we have implemented an R."
2474.83,2501.39,"in terms of a neural network. Yeah, clear? That's the basic idea. So this is an or, and now I'll try to, so these are the types of questions that we could also ask, let's say, at a written exam. Now implement, let's say, a particular logical formula, right? Because this is the or. If you look at the end, it is this, right? We just need to move that line."
2501.62,2532.35,"So now this was minus half before, and this is, let's say, now minus one and a half. So they both need to be one in order to return a value above zero. Note that there are, of course, many different lines that would have the desired outcome for these, let's say, four training instances. And it also shows the flexibility, but also the danger."
2532.35,2562.38,"So we have seen R, we have seen AND, and now the question is, can we implement XR? And now we have the following problem. So line 1 was the line that we saw for the R. Line 2 was the line that we saw for the AND. But now we have the complication that we want these points to be equal to 1."
2562.38,2592.1,"And we want this point and this point to be equal to zero. And now, think of all the kind of linear machinery that we have explained before. This is impossible. I cannot draw a separating plane in this two-dimensional space that would have this property. So if we would now go to SVMs or whatever, we would need to lift the number of dimensions. We need to now add something that these two points, I don't know, go up and the other points go down."
2592.1,2623.49,"or something like that. So you can prove that a simple neural network, a perceptron, cannot implement an XR. And it shows immediately the limitations of things. And I just wrote down the formulas. And so we know that if X1 is false, X2 is false, then the output should also be false. So we know that this weighted sum,"
2623.49,2652.11,"should be smaller than 0 if x1 is 0 and x2 is 0. Also, to take a look at 1, if, I don't know, x1 is 0 and x2 is equal to 1, right, so we are looking at the second row, then the output should be 1, so you should have a value of at least 0. Do we all see that these equations should hold, right?"
2652.66,2680.83,"This was under the condition x1 is equal to 0 and x2 is equal to 0. So if I look at this first line, you can basically remove these terms. So I know that w0 is smaller than 1. I can also fill in these values and I know that w0 plus w1 plus w2 should be smaller than 0. So I can simply fill out."
2680.83,2709.36,"the X1 and X2 values, and then I get this. Right, again, I just look at these expressions and I just fill in the X1 and the X2 values in every row, and then this is what I get. And now you can very easily see that this leads to a contradiction, so you can add up the first two expressions, and you can add up the second two in equations, and"
2709.36,2739.22,"Of course, the sum of two negative values is negative. The sum of two positive values is positive. And now you can see that there is a conflict. So this is a mathematical proof showing that the perceptron cannot implement something as simple as an XR. And it shows why in a neural network we need to have multiple layers. And it also shows immediately where, I don't know, SVMs and logistic regression, et cetera, et cetera, would fail. Without lifting the number of dimensions."
2740.21,2770.1,"So the conclusion of this is we need to have more layers in order to support this. And in a minute I will show you, let's say, a two-layer neural network that is able to implement this XR function. So this is like if we zoom out, because of course an XR is very similar, so in all the situations where there is not like a separating, let's say, linear hyperplane,"
2770.1,2798.24,"Like in all of these situations, we can kind of address this problem by adding more layers, right? That we can fit shapes that you could otherwise not fit. There are many, let's say, neural network structures that you talk about. I will only talk about feed-forward networks, right? Because for that I will explain things in detail. There are lots of, let's say, special neural networks."
2798.24,2827.98,"dedicated for specific tasks. So the two ones that are best known are, for example, convolutional neural networks to deal with images, right? You can imagine images are very special, right? Because you have pixels that are in an X and Y direction. You can talk about how close two pixels are to each other, et cetera, et cetera. So you can exploit these properties and use special network architectures for that."
2827.98,2855.63,"Also think of a picture of a dog, and you would rotate the picture of a dog a bit, like all the pixels will have different values, right? And you want it to be robust to things like rotation, etc. And that's what these more complicated architectures do. Another, let's say, very well-known architecture is, let's say, called LSTM, so long, short-term memory."
2855.73,2885.44,"And the reason behind this is that everything that we have looked at so far, the input size of our data is fixed. Right? We have a number of descriptive features, and we try to predict the target feature. But the number of columns is fixed. Of course, this immediately fails the moment that we are dealing with sequences. Because if we are dealing with sequences, then it is not fixed."
2885.44,2914.18,"You can start with the short sequence, and the sequence can grow, let's say, infinitely long. And also, the order matters. If I'm training a decision tree, if I would swap the position of the columns, it would have no effect on the result. But in sequences, things orderly matter. This is where these LSTM..."
2914.18,2942.66,"networks play a role, and they basically have a memory that, let's say, you remember what has happened in the past, right? And if you then go to the attention mechanism that we'll talk about in one of the later lectures, this is even more sophisticated, right? But it tries to capture, let's say, what is important of the things that have happened before. As I said, forget about all of this. It's complicated enough as it is."
2942.66,2970.64,"We just look at feed-forward network that looks like this, right? And all the connections, they go from one layer to the next layer, from one layer to the next layer, etc. And if we train it, we measure the error here, and then we propagate backwards this error, and we know how to update the weights. So that's the basic architecture that we will focus on."
2970.77,2999.63,"And we choose the activation functions in such a way that we can actually backpropagate, let's say, the error. That we know what we should change. So this would be a one-layer network. We can implement an R. We can implement an AND. This is a two-layer network which allows us to implement an XR. Something that was impossible by doing this."
3000.56,3030.51,"So this is a repetition just to keep things together. So this was the single layer R. We've seen that before. So the weights are minus half 1,1, what we have seen before. This was the single layer end. Also something that we have seen before. I'm just repeating things. You can also implement a knot. That's the one that is being shown here. So like this is half."
3031.02,3058.59,"minus x1. So if you take half minus x1, we get a negation, right? Because if it's positive, it becomes negative. If it was negative, it will become positive, right? So again, like here, you see the full expression, what is being represented here. So minus x1 plus half is the sum, and then we apply this function."
3058.59,3084.62,"So if x1 is equal to, let's say, 0, it remains positive. If it's equal to 1, it becomes negative. So we swap the sign. So if you look at logic, like if you have a bunch of these basic operators, you can combine them to have arbitrarily complicated logical expressions."
3084.62,3115.57,"With these building blocks, we can build more complicated functions, including the XR. So what was the XR? So it has these values in the middle that are 1, but if everything is true or everything is false, we should return false. And this is the network. So you would like to build a network that looks like this. It's now a two-layer neural network."
3115.57,3143.22,"Where, like, this is what comes out of this neuron, Y1. This is the expression what comes out of Y2. And this is the expression what comes out at the end. And our activation function is the same in all the cases. So now we have, how many are there? We have nine weights."
3143.54,3172.42,"And now we need to find the weights in such a way that this truth table holds. Right? And again, there are many possibilities to do so. So here you see, let's say, a possible, let's say, assignment of the different weights in such a way that we implemented this formula. Let me try to explain. So if we have here minus half..."
3172.42,3201.49,"and here we have 1, and here we have 1, then I hope that you remember this was the inclusive OR. We have seen that before. If we have 1, 1, and we have this constant 1 times minus 1 and a half, this was the end. So we have seen these two neurons before. And now we use this one, that looks a bit, let's say, different of what we had before, but still something that we can express."
3201.49,3230.9,"So this y1 corresponds to x1 or x2. This y2 corresponds to x1 and x2. And now we take this should hold and not that should hold. And if you do that, then you get the result. So please apply the table on the previous slide. And you will see that this actually gives you the right result."
3231.28,3260.91,"So for example, try to fill in zero here and zero here, and then you'll see that zero comes out at the end. If we insert one here and one here, then also zero will come out, right? Because of the knot that is there. Yeah, so this is the general idea. So we will often look at pictures that look like this, which show you the different layers."
3261.1,3288.53,"that are connected, let's say, in this feed-forward sense. And like we often number, let's say, the weights within what layer they are and from which neuron in the previous layer, they go to the neuron in the next layer. So that's the way that looks. If we just look at two layers, we again can write this down as a formula."
3288.53,3316.43,"What I'm showing you here, this network can be written down as a formula that looks like this. We first go through the first layer and we compute these things and the output of what happens in the first layer is passed on to the second layer, multiplied by these weights and in the end we get this output."
3316.5,3345.62,"Like here, the number of output neurons is the k value between 1 and n. And we can see that the number of inputs is equal to d and the number of nodes in the hidden layer is equal to m. Right? And like if you compare this picture with the previous picture, that should become clear. And so here you can see that next to each other, just let's say for your convenience. So this k."
3345.62,3375.6,"is referring to which of the output neurons we look at. Then we have these different activation functions, so I'm assuming that here an activation function H is being used, here an activation function F is being used. It could also be all F, right? Just to make you point out what the references are. So each of these nodes that is labeled here with an H,"
3375.6,3403.26,"named after the activation function, we take the weighted sum of the inputs. And these are the inputs going from I to J, right? So this is the weighted input of a neuron J in this hidden layer. And to this weighted sum, so assume that this would be neuron J, right? Then we take the weighted sum, we apply F."
3403.26,3434.45,"And then this is kind of broadcasted to all the neurons in the next layer, multiplied by this weight. So all these values are corresponding to the weights that we have here. And again here, for every node, we look at the weighted sum of these different inputs and then apply the activation function to it. And I show it now for two layers. So we have just one hidden layer."
3434.45,3471.25,"But I could, I don't know, also extend this that we would have 10 or 100 layers. Is this clear? Right? So this is, yeah. So I'm using here this, let's say, superscript to indicate this. And I'm using this to number things in the different layer. But of course, like, the number one appears here, but the number one appears also here. Right?"
3471.25,3505.71,"to see how you need to interpret this depends on which connecting layer you are. Right? So if I look here, for example at this one, this one is referring to this one, and this one, the second one here, is referring to this one. That's the first in that layer. Because if I would give them all unique names, then it would be highly confusing. So this one is, this is the first one, this is the first one in the hidden layer."
3505.78,3543.68,"And this is the first one in the output layer. Because if I would give them all different names, it would be highly confusing. So here, if we have here M neurons, and here we have N neurons, we get M times N, sorry, M times N, a different weight. And that's what you see here. We see all the combinations of all numbers."
3543.68,3576.42,"They are completely random, right? And you will often see that. Of course, you can make a sophisticated choice, but in principle, it's okay to make everything zero. Or everything one, or everything 100, right? That would not matter. Sorry. So, I'm using, I'm reserving here the zero to refer to this special thing that has a constant input one. So, every layer..."
3576.42,3606.77,"also has a 0, 1, 0, 2, until 0, m, where there is this constant. So this is this b value that you saw earlier. Right, so each neuron has a constant associated with it, and the constant is fully defined by this weight factor. And every neuron that you see here has such a constant."
3607.38,3647.17,"So you could think of this as b1, b2 until bm. No, no. What is random are the weights. What x1, x2 and xd is our training data that goes in there. So x1, x2 and xd until xd are not random. We feed our training examples in there. But the weights can be chosen random."
3647.17,3680.46,"We just randomize all the different weights. Then we see what happens, and we measure a certain error, and we know how to improve it. That's the idea. There is no superscript zero, because in a way, this is the input. It's a bit confusing, but also some people would say this is, let's say, a one-layer neural network. Other people would say it's a two-layer network."
3680.46,3703.62,"And it depends on whether you count the output layer as a layer, right? The same you could argue, yeah, is this now an input layer or is it not a layer? This is just the input. There are no neurons here. There are only neurons here and neurons here, right? Just for conventions, right?"
3703.62,3734.53,"It is good to have this question so that you let it sink in, because on Monday you will often look at pictures like this, and then it's important that you have an intuitive understanding how that works. So we often use as a shorthand, it's not so relevant now, where we kind of, what is indicated here in red, we call the ZJ. So this is after we have applied the activation function, and this is again the input for the next layer."
3734.53,3762.77,"That's where we often use this set function. Let me now explain the basic idea of backpropagation. As I said, I will provide you very detailed with the formulas on Monday how this actually works. This is our neural network. It is fully defined by all the weights that you see."
3763.02,3792.75,"And we have an error function, and the error function looks exactly the same as what you have seen before. And this is done for technical reasons. So we take the error squared, and we do this in such a way that the derivative looks very nice. That's the idea. And now when we look at that error, we try to minimize it."
3792.75,3820.46,"We start by just randomizing the initial weights. We just take random numbers. And if we then apply this to a training example, so for a training example, we have concrete values of x1 until xd. So these are the columns in our table. And for one row, we simply insert the values. And then the neural network, based on these random weights,"
3820.46,3851.09,"is giving these values, right? So this is what the neural network is producing based on completely randomly chosen weights. And we know that corresponding to this input, we want the target feature to say that it is class two, right? So I assume that this is a classification problem. It would not matter if, like here, my variable is categorical."
3851.09,3880.24,"So all of the output cells should return a value 0 except one that has a value 1. This is a classification problem. So this is what it computes and this is what ideally it would compute. Ideally, based on this input, it should say it belongs to class 2. And now we can simply, let's say, look at the difference between the predicted value and the..."
3880.34,3910.8,"the real target feature that would like to come out, and then we see all of these errors, and we see the error is 16.32. It doesn't say anything intuitively, right? But because of gradient descent, based on, let's say, this backpropagation idea, we now know how we should change the weights in such a way that this error goes down."
3910.8,3939.02,"initially our weights were completely random, and now we know how to update the weights in such a way that it gets better, right? Because we know the derivative of the error function. And by doing this, we for example, as I now explain it very simplistically, in reality all the weights are updated, but assume that this weight is increased, that by increasing this weight we now get this."
3939.18,3966.34,"and we know how to nudge these weights in such a way that the error goes down. And then I apply it again, and then we have this error function. And now, if the gradient CSAN says, okay, we can still reduce that error, we again update the weights, and we again update the weights, et cetera, et cetera, until we reach a minimum. Yeah? That's the whole idea. I'm showing you that for one instance."
3966.34,3996.08,"But you can imagine that you should sum that over all the instances that are in your input set. And then you also realize why this is a very costly process, training these weights. Is that clear? As I said, on Monday I will explain this with formulas, etc., etc., but it's important that the idea sinks in. And we have this idea of, let's say, the moment that we know in which way we should walk to reduce the error."
