start,end,text
1950.51,1979.7,"But I and J are referring to a different layer, right? And I do not want to subscript Z also with a layer, right? I showed that in the previous lecture, but that would completely make you, let's say, mad, right? You would not be able to see anything. So when I'm using the terms ZJ or AI or something like that, we are always referring to these, let's say, layers that we have here."
1979.7,2009.76,"So a neuron has an input, the layer where the neuron resides itself, and an output layer. Just that you do not try to interpret too much into that. So what is now our goal? This was the error function. These are the formulas that I repeated. And our goal is very simple, right? We want to see how can we reduce the error. So we want to find, let's say,"
2009.76,2039.55,"If we are nudging this weight, so we are changing this weight, what effect does this have on an error? And think of a derivative. What does this mean? If I would make a very, very tiny change to this vector, sorry, to this value, a super small change to this value, then I can see what the effect on the error is. So if I increase, so if this is a positive number,"
2039.55,2070.54,"then that means that if I increase this, I increase the error. Right? And we want to reduce the error. That's why there is this minus here. Right? So Eij is basically telling us in which direction we should update the weight to reduce the error. Looking at just a single arc in our entire network. So we look at what is the..."
2070.54,2100.98,"What is the effect of changing this weight just a tiny bit on the error? And we want the error to go down, and that is explaining the minus. Clear? That's the basic idea. So, now, if we have a certain, like an arc that has a particular weight, then the new weight will be the old one plus this. And how to update this is informed by this."
2101.55,2130.91,"But we need to determine the step size. We need to determine, let's say, how big the change is that we want to be. And so this only gives us a direction. Is the effect of changing this weight, is it positive or negative? And you can also see how strong the effect is of changing this. But we do not know how big the step is. And so think of this, you're walking down a mountain and you're making, let's say, steps."
2130.91,2160.5,"And you can make many smaller steps into a particular direction or you can take very big steps. And in principle, if your step is too big, right, then you're kind of stepping over the valley, right? You're stepping from one mountain to another mountain, right? So that's why we have L and that is this learning rate. So think of L and L is again like something that is based on experience."
2160.5,2190.48,"So this is a learning rate or scaling parameter, and the goal is to reduce this error. What typically happens is that we start with a larger value of L. In other words, we start with bigger steps, and then we later go to smaller steps. Okay, so now I've set the scene. We want to reduce this, and we want to see the pipeline of how is this weight."
2190.58,2219.5,"influencing this error. And that's the only thing that we need to know. So if this weight is increased or decreased, what kind of effect does it have on the error? Because if we know that, we know how to update, let's say, that weight and reduce the error. It's very simple. And this weight is influencing only, and mark my word only,"
2219.5,2248.66,"If I modify this weight, I'm only changing AJ in the next layer. I'm not changing any neighbors of J. I'm just influencing J. And if I influence J, I'm just influencing ZJ. Because this only has an effect on this one. And then if I change something like this, in the end it has an effect on this."
2248.66,2278.0,"So this is like the chain of how the effect is being passed. And now the only thing that we need to do, so here I repeated all the formulas that I showed you before. The only thing that we need to do is to compute this. Simple, right? That's the idea. But to put this into, let's say, the concrete things that I was showing you on this sheet."
2278.0,2307.89,"right, we now need to, let's say, solve this expression. And there are two, as you can see on this sheet, there are two situations, right? And therefore I'm rewriting the problem several times to get down to these two, let's say, core situations. So using the chain rule that I explained before, let's say this derivative, so the fact of nudging,"
2307.89,2338.78,"weight ij on the error, can be rewritten in this way. And if I go back here, see this relationship here. So this error, this derivative, can be rewritten like this. And the green part is easy, and we do not need to do any case distinction. For the red part, it's more complicated, and we need to look at two situations."
2338.78,2370.0,"whether we are in the last layer or somewhere in the middle. So let's first look at the easy part, the part that is there in green. And this part here in green is looking at what is the effect of changing weight ij on aj. The naming is a bit weird, but you see what I mean. So we want to have this term. And that term is actually very easy."
2370.0,2399.1,"So we first focus on this. So what effect does changing this weight have on this? It is not influencing any of the other arcs going in. So any of the other arcs going in are like constants. We only change this arc. And that means that the only thing that is influenced by this is, so this part is a constant."
2399.1,2428.18,"For all the arcs coming in that are not equal to i, right? All i primes that are not equal to i, this is constant. And only this part is actually depending on this weight. So we can ignore this in the derivative and we just need to take the derivatives of this part. And we are changing weight wij, right? So this is simple that this is the..."
2428.18,2459.22,"derivative of this function. So in other words, the effect of changing wij is influencing aj with the factor zi, which is logical because that is like we multiply this number with that number. Do you see that? It's simple. So if we have the derivative of ax, the derivative is a."
2459.22,2487.54,"Right? That's the thing applied. So now we have a nice expression for this one and we fill that in here. Right? So now like this part is already solved. I copy that to this slide. Right? So we now know that this is this. So now we have this part that is unknown. And for this part, because that is more complicated to compute,"
2487.54,2527.38,"We use, let's say, this expression for it. So EJ is equal to minus the derivative of the error with respect to AJ. Yeah? Sorry? No, it's not a value. It's a function. It's a function depending on all the weights. Right? And we are nudging weights and see what the effect is. Right? So we are just looking at derivatives. We are not looking at concrete values. Right?"
2527.86,2560.16,"So, this green part was easy, the red part is more difficult, and that's why we use this expression. And the intuition that you should have here is, what is the effect of changing the weighted sum that goes in on the overall error? If we were able to influence this weighted sum here, what is the effect on the overall error?"
2560.16,2588.69,"That's what we need to do. And again, we can use our chain rule, right? So it's very nice. That's why I spent some time in the beginning explaining that to you again. So if we want to compute what the effect of changing AJ on the error is, that is the same as this. And why is that the case? This weighted sum is only influencing the error through ZJ."
2588.69,2620.58,The only connection between what goes in here and the error that may be 10 layers further is only effectuated through this ZJ. So we can rewrite this again using the chain rule. And now again we have two parts. So we have let's say this part and we have this part. And this part is also very easy.
2620.58,2647.95,"If you compute this derivative, and I will show you that in a minute in step by step, but for now just accept that the derivative that I compute here is the derivative of this formula that leads to this. So now this term that I have here can be replaced by this term. And this is the reason why we are using the logistic function."
2647.95,2675.98,"Note that we are taking the derivative of a logistic function with respect to changing aj, and it leads to this super elegant expression. So now we can fill in this by that. So again, we make our problem, let's say, more concrete. So I've now filled in, let's say, this derivative, and we have this."
2676.69,2702.61,"So the only part that is still unknown is this part, right? Because we know that Eij is equal to Ej times Zi. That's what we computed before. We know that this term is equal to that. So the only part that is missing in our whole machinery is this. Do you see that? Store this formula in your mind. There is a start here, right?"
2702.8,2730.99,"because I first want to explain you, let's say, more clearly why we got this. And then I will continue with this one. So what is the derivative of this? And it's not complicated. It's unrelated to, let's say, neural networks. It's just, let's say, applying, let's say, high school mathematics. So the derivative of this is that we first apply the chain rule again and assume..."
2730.99,2760.67,"And so just think of this as y, right? And if we take the derivative of 1 divided by y, that is y to the power minus 1. And the derivative of that is equal to, let's say, minus 1 divided by y to the power 2. Right? So high school mathematics, the derivative of 1 divided by y is like y minus 1. If I take the derivative, that is minus 1 times..."
2760.67,2790.7,"y to the power minus 2. Right? And that's what I did here. I just think of the green part as y. But using the chain rule, of course, I also need to take the derivative of y itself. So this is this one. And if I look at this, this one is a constant. And now again, I can apply the chain rule here. Right? Because I have e to the power a minus 1. Now I think of this as e to the power, let's say, z."
2790.77,2821.3,"And I compute the derivative where z is equal to minus aj. So e to the power something, e to the power z, and the derivative of that is still e to the power z. So this doesn't change here. But we still need to take the derivative of this function. We apply the derivative of this. So minus aj, what is the derivative of minus x, is equal to minus 1."
2821.3,2850.35,"Then we get this. So here you can see the rules that I applied. So now we have a complete expression where I applied the chain rule twice. And now I can rewrite as minus 1 times minus 1 is simply 1. I can move this to the top, etc. I can now also rewrite this into this part. Note that I..."
2850.35,2880.11,"divide by this to the power 2, so I can separate one of them, and then I have e to the power minus aj divided by 1 plus e aj, right? And I can rewrite this in this way. Did you see that? So here, I'm not doing something sophisticated, just let's say I'm using some mathematical rewriting. So now we have this, and now we see something that is really beautiful."
2880.11,2909.36,That's why I did it like that. Remember that Zj was equal to that. And what do we see here? Here we have Zj. And here we have Zj again. So I can rewrite this into this part. Do we see that? So this is the derivative of the sigmoid function when we vary Aj. And the derivative is shown here again.
2909.36,2942.24,"So this is one of the reasons why we use the sigmoid function, because it had such an elegant property. Remember, we get this term, and now we continue where we left out before. So this part came from what we have seen before, and this zi came, let's say, from the expression that we have seen earlier. So the only part that is still missing is this part. Are you still with me?"
2942.24,2970.67,"So this is left to compute. And now, until this point in time, we didn't care whether it was like a neuron in the output layer or a neuron in the middle. I did not use any of these properties. But now I'm forced to do case distinction between are we already at the end or are we somewhere in the middle. And it's called backpropagation. So we start at the end and then we propagate."
2970.67,2999.18,"the updates and the errors, let's say, backwards. So here I just repeated what I showed you before. This is the term that we are after. This is just a repetition of the expressions that we have seen earlier. And now just look at this formula. We are interested in the effect of changing Zj on the error. If we are at the end,"
2999.18,3028.69,"So we are looking at an output neuron. This is very easy, because this is our output, Zj, and this is the feature that we would like to have. So this is very easy. And note that if we are at the end, the final neuron is only influencing one of these output features, because it's dedicated to a particular feature."
3028.69,3056.18,"So this is the situation that we have now here, and it should be clear that Zj is only influencing Tj and not any of the other ones. So using this insight, I now compute this derivative, the one that we are after. So I fill in the error function, and I didn't change anything, it's just the error function that we had before."
3056.4,3084.66,"So this is the error function. We want to have the derivative and we are changing only Zj. Note that all the Zj's, the other ones are irrelevant. So this one is only influencing this one. So we can focus completely on this term because all the other terms are not influenced by changing Zj."
3084.94,3115.47,"So only this term is being influenced. So this is a constant, I can remove it, I look at the derivative of this, and this is why we always write error in this way, because it now simply becomes this. So this is half to the power, I don't know, x to the power 2, and et cetera, apply the chain rule, and this is what comes out. So the effect of changing zj,"
3116.5,3146.74,"The effect of changing Zj on the error is this, which is because of our carefully chosen error function, this looks very elegant. If we simply say we take the sum of all the errors, we would not have gotten such a simple expression. Problem solved. I can now fill in, let's say, all the different things."
3147.22,3175.31,"So we simply get this expression here that is there and we have ej and we have all the values, right? Because that was the only part missing. So by combining this with the earlier formulas, we see this and we see this as the change that we need to make where we are multiplying it with this, let's say, factor L, right? As I said, we are just applying, let's say, now..."
3175.6,3206.78,"the combination of all of these different formulas. Right? Clear, this part? There is a special case that I kind of skipped over that was this one. Right? I was always talking about earlier neurons. But this one has a constant 1 multiplied by this. So what we know is that Z0, the one that goes in here, is equal to 1. And that means that for this special weight,"
3206.78,3236.24,"We can simply fill in the number 1 here and we get this. So just a simplification, one of the terms zi is disappearing in this setting. So that was the situation where we are at the very end. Now we look at the situation and then you also understand why I took so a lot of effort to cleanly define all these different things."
3236.24,3268.42,"Now we are applying a kind of recursion. So now we look at something in the middle. And this is not an output layer. This is now a hidden layer. So J is now in a hidden layer. And we are interesting, so we are still just left to compute this term. So what is the effect of changing ZJ on the error? What is the effect of changing ZJ?"
3268.42,3294.26,"on the error. And there may be a whole network behind it, right? There may be 10 layers after this. But because of the notations that we showed, we can now, let's say, apply it in a recursive way. So let's just focus on this part. So Zj, if I'm changing that, I'm potentially changing all the..."
3294.26,3323.6,"the weighted sums that go in all of the neurons in the next layer. So we are not influencing one neuron, we are influencing all the neurons. If we change Zj, we are impacting everything in the next layer. However, we know that if we are changing this, like the other inputs that are going into the next layer are not changing. So here it is kind of..."
3323.6,3350.69,"saying what I just said. So a change in Zj impacts all Ak's, right? But if I look at a particular Ak in the next layer, it is only influenced by Zj. The rest is constant, right? And that's what we are using when we compute the derivatives. So let's again apply, let's say, the sum and chain rule."
3350.69,3382.93,"So here we are interested in the effect of Z, J and error. Using the sum rule, we can simply say, okay, let's take a look at all the, so when we have multiple output neurons, is it impacting all of these things? We use the sum rule for that. So K is ranging over all the output neurons in the next layer. And we split that into this part. So again, chain rule."
3382.93,3410.93,"We know that ak is equal to this, so we rewrite it in this particular way. Again, these two terms are, let's say, changing each other. Again, we have two terms, this term and this term, that we need to compute. Now we can apply recursion, because we have defined ej to be equal to this."
3411.12,3440.45,"And if I replace j by k, you can hopefully recognize that the same term is appearing here. Right? So, in other words, we already know this. So, we only have to compute that. Yeah? So, this part, as I just indicated, we know already what it is because we have an expression for that. And, like, there is a minus here. But there is also a minus here. Right? So, we need to rewrite that like this."
3440.45,3472.85,"So this can be rewritten to this. And this minus is removing this minus. The only thing that remains to be done is this part. Yeah? It's called backpropagation. Right? And it's called backpropagation. So we can now assume, because we started with the output layer, and now we are working our way inwards. Right?"
3472.85,3502.51,"We come from the back and we go to forward. So we can assume that we already know this. Because if this was the last layer, we have this expression. If it's not the last layer, we can look at the layer before and first solve that and then go to the next layer. So we can assume that we already know all the EK values for all the neurons here. Because we start at the back. It's like..."
3502.51,3532.67,"induction, right? We start with case 0, that's the end, and now we walk our way backwards, right? To the beginning. So that allows us to assume that we already know this, right? Because first is the output layer and etc. So we now have this, right? And the thing left to compute is this, but that's very simple, right? So we now"
3532.67,3559.42,"I'm just repeating what I had before. If you look at this, what is the effect of zj on k? All the other inputs are not changing. The only thing that is changing is this term times that term. So we can rewrite this into, let's say, this expression, which is equal to simply the weight wik."
3559.42,3589.36,"So now we can fill out this value and now we are really done. We have, let's say, closed expressions for all of them. And I realize it's very difficult for you to keep track. That's why I'm constantly, let's say, repeating all the formulas that we have here that we kind of do this step by step. So here I'm, let's say, putting all of our knowledge and we get, let's say, this expression for EJ if the neuron is in a hidden layer."
3589.78,3619.6,"And here, let's say, this Eij and how we should change the weights. I'm again just filling out the formulas. There is this special situation again. If we look at, let's say, this neuron that is like a constant. There's 1 times this. So again, we can fill in these values for Zi equal to 1. And then it simplifies to this. So that's just..."
3619.66,3649.58,"like a simpler case. So what have we now seen? We know that how to update the weight, assuming a learning, let's say, rate equal to L. If it is in the output layer, we need to update it using this expression. If it's in a hidden layer, we need to apply this in a hidden expression. And now to go back to your thing here, like it may be odd that we are, let's say, assuming that there is a K,"
3649.58,3674.27,"But every layer, let's say, only depends on the next layer. And for the next layer, we have already computed if we go backwards. That's the idea. So this is now, let's say, the single thing that I showed you in the beginning that shows you basically all the formulas. It fits on one page."
3674.27,3702.51,"But, of course, you also realize you are unable to apply it if you do not know what it means. That's why I had to walk you through this process. But I also hope that you appreciate that you really see, rather than that somebody just dumps some definitions on the screen without explaining how it works, that you appreciate that you now hopefully really understand how it works. To summarize, we are nudging weights."
3702.51,3732.66,"and we know in which way we need to nudge the weights to reduce the error. And we repeatedly do that. Some comments related to that, there is this parameter L, which is the learning rate. It's typically, it could be a constant, but you can also use a strategy to reduce it, let's say, over different rounds. So you first apply everything with a certain learning rate."
3732.66,3761.57,"and over time you make it smaller. That's like you're walking down the mountain, and in the beginning you're making very big steps because you're clear that you need to go to the valley, but then you're almost at the valley, but you do not know really what the lowest point is, and then you start taking smaller steps. That's a possible strategy. And I hope that you can see when we were talking about regression and SVMs that there were similar things."
3761.57,3791.31,"that were used there. So far, all my formulas were just devoted to a single instance. We are updating the weights based on a single instance. And you could repeatedly do that. That is called instance update. And that means that you look at one instance at a time, change the weights a bit, et cetera, et cetera."
3791.34,3821.65,"Another thing is that you do this in batches, so you do not update the weights for every individual instance, but you update it for the whole data set, or you partition the data set in batches, and then update it like this. One epoch, that's a term that is often being used, that means that you have made one round in such a way that you have used all the instances once to update the weight."
3821.65,3848.88,"So one epoch could be just a single update where you update the weights based on all the instances in one step, or one epoch could be as many steps as the number of instances that you have, right? Because you do it for every instance, let's say individual. So both strategies can work, and people typically use something in the middle, right, where they determine this batch size."
3849.17,3880.75,"From a theoretical point of view, only batch updating guarantees that you reach a global minimum. Note that there could be this, like with instance updating, that goes much faster. You look at one instance and you update the neural network, rather than computing everything for a million instances and then doing an update. So this may be faster."
3880.75,3909.58,"but it's also a bit unpredictable because different instances may lead, let's say, the weights in different directions. So if you want to have strong guarantees that you're reaching a global minimum, then you need to do the updates for the whole data set as well. And experience shows that typically something in the middle is something that works better, that you do not have this kind of seemingly random behavior."
3909.58,3940.18,"That you have something like this, but that goes faster. So how can this work? So before we were basically just considering this situation. So how can we do this situation? And that is due to the sum rule. So the error of a batch is the sum of all the errors over the different instances. This was the error for a particular instance."
3940.18,3970.64,"So I can simply rewrite this into this term. We are now interested in how should we nudge the weights not for one particular instance, but for the whole. Our goal is to minimize the error not for one instance, but for all instances together. And they may be conflicting, right? But we want to minimize the overall error, which is simply the sum."
3970.64,3999.58,"And because it's simply the sum, right, the derivative of the sum of something is simply the sum of the derivatives, right? So that's why you can compute this in an easy way, right? So the way that it would work is that you apply the neural network to all the instances, you get errors for all of them, and using that you update the weights, right? That is the way to go."
3999.58,4025.63,"Then when to stop, you hopefully reach a situation where the derivatives are equal to zero, but convergence can take a long time. So there are different strategies to stop. And it may be that you need to consider your data hundreds or thousands of times. This makes this an extremely expensive process. And that's why you see..."
4025.63,4068.69,"At the moment that you're dealing with neural networks, you typically need to have lots of hardware to be able to do this in a meaningful way. Clear so far? You can do that. If you look in certain textbooks, they will actually do that. But there is no difference because whether you are trying to reduce the sum or the average, it's exactly the same thing. So you can divide it by the number of instances."
