start,end,text
3.28,31.22,"Okay, let's get started. Welcome to lecture number seven. Today we have one goal and it's very simple, right? I wrote a bunch of formulas on this slide and the goal is that you understand this, right? And you need to be able to apply it and you can only apply it if you actually know what these things mean."
31.22,59.6,"So please bear with me today. I will walk you through the complete derivation of these formulas in such a way that you really understand it. And then this is the hidden secret behind the neural network, right? This is in the end very simple if you understand how it works. So the agenda for today is that in the first lecture,"
59.6,90.99,"Last week on neural networks, I introduced what a neural network is. It's a bit disturbing if people come so late. Now they do not know what the goal is of today. So I already introduced a neural network and we looked if the weights have certain numbers, how you can do this feed forward. What we will focus on today is that if you have lots of training examples,"
90.99,119.28,"How do you update this new neural network? And that's the goal. After this lecture, we will be done with standard supervised learning techniques. Like what comes after this is unsupervised. How to evaluate these techniques. And we will start looking at special types of data like time series, event data, text data. And then we go into more, let's say, specialized topics."
119.82,149.62,"So let me repeat, because it's Monday morning, let's say, where we stopped, let's say, in the last lecture. I explained you what a neural network looks like. So we have a bunch of neurons. We also saw that if you want to express something as simple as an exclusive R in logic, you need to have, let's say, a hidden layer in the middle. And I gave you proof."
149.68,173.84,mathematical proof that that is impossible to do without having an extra layer in terms of these formulas. So we have outputs numbered y1 until yn. We have inputs numbered x1 until xd. And here we have one hidden layer in the middle. And typically we have many more.
173.84,203.68,"Just to explain the notation, this is sufficient, so you can imagine that there are multiple layers of these blue nodes, and they always have connections where a neuron of the previous layer is connected to all neurons of the next layer, but not more. So it always makes one step. So there are no connections, I don't know, from here to here, or something like that. It always goes just to the next layer, but it's fully connected."
203.68,225.3,"architecture that we assume, and what I showed you, let's say, in the lecture last Wednesday, was that you can think of this as function composition, right? Every layer is basically a function call, right? And you do this repeatedly, and that's how it works."
225.94,254.43,"Like if you have such a neural network and you have the inputs, it's very simple. You just multiply all the inputs with the corresponding weights and then you sum them, let's say, at every neuron. Then you apply an activation function and then there is an output that is given to the next layer. So we will see that again in more detail, but that's pretty easy. And we start by randomly assigning weights to..."
254.43,283.71,"We start by randomly assigning values to all these different weights. And if we do that, for a given input, we get certain predictions. But we are doing supervised learning, so we know what the output should be. And then, for every output neuron, we are comparing the, let's say, predicted value with the actual value. So it could be that, I don't know, these are the values that are predicted."
283.71,312.53,"These are the actual values. We have this error function. And today, again, you will see why it has this, let's say, odd structure. It has this odd structure because the derivative of this is very simple, right? It's just yk minus tk, right? If you take the derivative of it. So we compute the error using this function, right? So we take the difference, we square it, and we take half, and we sum up these things."
312.56,341.28,"And now the basic idea is that we, given a certain error, using gradient descent, we know in which direction we have to walk to reduce that error in a maximal way. Right? We want to walk down towards the error. So the goal is to lower this. And through, let's say, computing all the different derivatives, we know, let's say, how to update all the different weights. So for example, we..."
341.28,368.86,"we may decide to increase this weight leading to this number leading to a lower error. So that's the whole game. And if we have set this up properly, then we reach, let's say, a global minimum for this, let's say, basic problem. Of course, what I was just telling you about is that we have, let's say, one input and one output."
368.86,398.05,"But we have, of course, thousands of training examples, or millions of training examples. So we should not just compute this term, but we should do that for all the different instances. So we should compute the error not just for a single input, but we should sum over all the different inputs. And using the sum rule, when you apply derivatives, like this is very simple. It's a lot of work."
398.05,427.25,"But from a mathematical point of view, nothing really changes. So in most of the lecture, I will focus on just a single instance. And using the sum rule, you can then apply that for everything. And I showed you this picture before. So this is me. And this is like the steepest way down. That is the main idea. And these pictures are just, again, to put a mental image that you see what we are trying to do."
427.47,454.7,"So we randomize the weights. So we may have a neural network with millions of weights. We just randomly pick values for all the initial weights. And then we are here. We have a very large error. But we know how we should walk down to minimize the error. Easy, right? So last lecture we focused on this forward pass. So given an input."
454.7,483.82,"Like using these weights, we know the sum that comes into a neuron. We apply an activation function and then we pass it on. That's this forward behavior. And this backward behavior is that we go in the other direction. We have a certain error. And using the derivatives, we know how we should update all the different weights. So in one go, we update all the weights in the whole neural network. That's the way that it works."
485.01,513.01,"Okay? And please ask questions if things are not clear. So there are some things that I will not elaborate on, but that are things that I assume to be given. For me, the goal is only that you understand the principle. There are many types of neural networks. So you need to decide, how many layers do I have? How many neurons do I have in any, let's say, hidden layer?"
513.01,542.38,"Do I use a neural network with a special structure? So later we will see embeddings, but it is very weird. You start with a neural network that has many neurons, and then you try to pass it through a hidden layer in the middle, which is deliberately small. But at this point in time, we do not care. Based on some experience, we have decided the number of hidden layers and the number of neurons in every layer."
542.38,569.25,"So these are, let's say, meta decisions that we need to take before. Of course, the number in the input layer and the output layer are often given by the problem. So if we have a table with 10 columns of which one is the target feature, then we would have an output layer and the target feature would be, for example, binary. Then we would have one output neuron and nine input neurons."
569.25,595.82,"That would satisfy the problem. Next to deciding how many layers and how deep, how big they are, etc., we also often want to pre-process the data. Note that neural networks, just like with regression, is just dealing with numbers."
595.82,623.74,"If you have numbers that you have one feature that has a value, I don't know, between 0 and 0.1, and you have another feature that has values between, let's say, minus 10 million and plus 10 million, it's good to normalize this first, right? Otherwise, one thing will have probably much more effect. So we need to normalize, and we need to also encode categorical variables in terms of, let's say, numbers."
623.74,649.34,"So we again need to use, let's say, one hot encoding. So we also need to initialize the weights. Just assume that this is random. And we need to decide when and how to update the weights. And this is a topic that I will deal with at the end. So you should imagine that now we just look at a single instance. We just look at one instance and we want to update the network."
649.34,679.47,"But of course, you have millions of instances, so you have the choice to update it one instance at a time, or you have the possibility to update it for the whole dataset. It's something that we'll come back to later. As I said, we need to deal with, let's say, numbers. It's typically good to normalize the data, that there are not big differences between that. If there are categorical variables, we need to use one-hot encoding."
680.75,708.99,"And so if, I don't know, you have a variable that would be, I don't know, very bad, bad, neutral, good, very good, right? You could decide to encode that into a single number, right? From, I don't know, from minus one to one. But if you have things like, I don't know, cat, dog, elephant, then you need to use, let's say, something that is called one-hot encoding."
708.99,738.96,"that you've also seen before. So if you have an attribute x that has three possible values, what you do is that you introduce three variables, one for each. And if this variable holds, you set it to 1. If it doesn't hold, you set it to 0. So this would be the vector 0101001 to encode three possible values."
739.06,764.35,"Right? It's something that we have seen in earlier lectures before. So now our life is simple. Our input are numbers and our output are numbers. And we just want to train the network such that given the input numbers, we are able to predict the right numbers that come out. Right? So it's easy. So here's some more information."
764.35,793.5,"So we can do a numeric prediction. We can also do a classification. If it's binary classification, we can have one output neuron with values between 0 and 1. That's a bit when we talked about the XR problem, right? False was 0, true was 1. That would be something that is in this category. If you have, let's say, more than two values, so for example, dog, cat, elephant, cow, right? Then you need to use one hot encoding, right?"
793.5,823.23,"That's what I said before. As I said, we need to initially give these weights a number, just choose them in a particular interval based on experience. Now comes a more important thing, that if we have a neural network, then any weight is a variable. It's a parameter of our problem. So it's completely logical that if our number of training examples"
823.23,851.55,"is smaller than the number of parameters that we have, that doesn't make any sense. So what this slide says here, and you should take that with a grain of salt, because of course it depends on the problem, it depends on the characteristic of the data, is that the number of instances in the training set should be at least 10 times the number of free variables you have, to make sense."
851.55,885.82,"If they are at the same level, it does not make any sense. And more is better. The more training data that you have compared to the number of weights is good. So just to make this slide, because I think this is very important that you understand that. I should be more precise. Perhaps in my language I was not precise. So we are trying to compute a parameterized function."
885.82,912.54,"You can think of a neural network as a parameterized function where we just need to find the parameters. And these are these weights, right? So we just want to set these parameter values, right? And if you would like to learn a function based on examples and the number of parameters of that function is higher than the number of examples that you can train on, it does not make any sense because there will be..."
912.54,942.05,"I don't know, infinitely many solutions that would produce exactly the same result. Just imagine that, suppose that you have two data points, right, and you would like to learn a function, right? Suppose now that you have a function that is of the form, I don't know, a times x to the power 6, b times x to the power 5, c times x to the power 4, et cetera, et cetera, right? You would have such a formula."
942.05,971.36,"and you would have just two points, that would be incredibly stupid, right? Because if you have two points, the best prediction that you can make is a straight line through these two points, and not some wobbly line that goes like this, right? So this is unrelated to the number of variables in the table, right? The number of variables in the table, perhaps if I show you this."
971.36,1001.18,"So the number of, let's say, columns in the table is this plus this. So if we think of our input as a table, then for every instance we have the input features and the output features. That's not what I'm talking about. I'm now talking about the number of rows. That is the number of examples that we have in comparison to the amount of free variables that we have here. So I'm not talking about features."
1001.18,1032.8,"I'm talking about parameters of the function, the weights, how many different weights we have, right? Therefore, I show you, let's say, a number example. Perhaps that helps for you. So suppose that I have this neural network, which is very simple, right? Because we have just one internal hidden layer. So if we have D inputs, we have K outputs."
1032.8,1062.45,"And we have m number of internal things. So how many parameters does this function have? How many free parameters that we can set? So it's simply counting how many weights we have here and how many weights we have here. And if you write that down, that is equal to d times m."
1062.45,1091.23,"With this plus 1 comes because every one of these has a constant coming in. And the same here, right? So the number of, let's say, weights that we have here is m times n. And for every, let's say, output neuron, we also have this constant coming in. Right? So this is the number of parameters. And our rule of thumb that we should take with a grain of salt says we need to have at least 10."
1091.23,1114.0,of these instances. So if I now fill this in and I hope that you realize that what the issue now is that if you have something like this and I for example set all we have 10 inputs we have 10 outputs for example because we have a categorical variable with 10 possible outputs
1114.03,1142.61,"So D is equal to 10. N is equal to 10. We have, let's say, 10 neurons in the hidden layer. We need at least over 2,000 rows in our table for the problem to make sense. So that is why it is very tempting to use a huge neural network, because it's very expressive. But the bigger you make the neural network, the more training examples you need to have."
1142.61,1168.67,"Right? There is a trade-off between these things. Yeah? Does this help? This is one-handed layer, but you could make exactly the same, like if I would repeat this one, this layer, right? Like I would have an other internal one, like it would be the same as this one. Right?"
1168.67,1199.52,"It doesn't grow exponential in the number of layers that you have. It grows linear in the number of layers that you have. Right? Because it's just the sum of all the things. Yeah? Okay. So this is the problem that we always see. So if we have a data set, then there is the challenge between overfitting and underfitting. Right? So if we have lots of points and we just assume it is a straight line that is not very useful,"
1199.52,1229.22,"But this is also not, like if I have a high dimensional neural network, I can train the neural network to follow the blue line. But it will not work very well on unseen training examples. Because it's overfitting the data. So let's get into the details. So here you see a slide that I hope brings you back to high school. With, let's say, the different formulas for the derivatives."
1229.22,1259.07,"So one rule that we use all the time is the chain rule. I think on the next slide I have some more explanation of that. There's also this exponential function that has a very, let's say, special property. If you compute the derivative of e to the power x, it is still e to the power x. What we are using also in the end is that is the sum rule. So if we have multiple functions depending on x and we sum up these different functions,"
1259.07,1288.54,"then we can basically compute them all individually and then sum them up. So this is the rule that we are going to use at the end when we sum up over all the different instances. This rule allows us to focus on just a single instance all the time, because in the end we can apply this rule. So what is the idea of a derivative? And it is related to this gradient descent walking down. So at a particular point,"
1288.54,1317.18,"like you can see in which direction you should walk to reduce the function maximally or to increase the function maximally. That's the idea. So a bit more about the chain rule that you see here, because we apply that frequently. So if we have a function that is composed of other functions, what we can do is that we can first take the derivative of f, assuming..."
1317.18,1345.73,"that gx is a variable. So just think of gx as y. So we first compute this. And we multiply then. So here, like in the first phase, this gx is like a black box, like a single variable. And then in the second step, we take the derivative of gx. And this is something that we use all the time. And if I write it like this, then suggestively..."
1345.73,1375.38,"although there is more behind it, then you can see the logic behind it, right? That these two terms, they kind of remove each other, right? Just to have the intuitive idea. Yeah, clear? Just because for many of you, this is probably, let's say, rusty. So if I take an example where fy is equal to y to the power n,"
1375.38,1404.45,"And gx is equal to x to the power k. Now I compose this function. So I have a function ax that does this. Then I have x to the power k. That is the application of gx. And then I do that to the power n. And if I have x to the power k to the power n, then that's the same as multiplying n and k. So we all know that. Let's now check whether this rule..."
1404.45,1430.7,"actually holds, right, for this particular example. So I first, let's say, compute the derivative based on this expression, then using the power rule, like this is n times k times x to the power nk minus 1, right, so this is, let's say, if we do this directly."
1431.09,1461.68,"And if we do that by applying the chain rule, that's what I show you here, then we first take the derivative of f treating gx as a y, as a variable. So gx was equal to x to the power k, right? So we get this n times x to the power k to the power n minus 1. So this is this part."
1461.68,1490.69,"And then in the second phase, we take the derivative of g with respect to x. And that's very simple, right? That is this formula. And now I write it down. And surprise, surprise, these two expressions are exactly the same, right? Which gives you, and you could apply it with another example, right? And then you can see that this rule actually holds, right? That we're based on an example. So these two are equal. So here it doesn't make sense."
1490.69,1520.42,"to do this in this stage way, but later we were constantly in situations where we have a function h and we try to decompose it into different parts. That's something that we use repeatedly. Here I use it with, let's say, concrete values, let's say 2 and 3, the same thing, and you can see that this holds. So that is a brief refresher of"
1520.42,1549.07,"of, let's say, derivatives. You never thought that would be useful, but the same as linear algebra, but in the world of, let's say, machine learning and AI, I don't know, statistics, linear algebra, and these types of things are suddenly, let's say, the core of everything. So it's important that you really understand this. So this is the layered architecture that we are using."
1549.07,1574.69,"I'm constantly repeating this, and I'm constantly also using i, j, and k, using these conventions to give you some structure, right? That you understand what it is. What comes into a neuron is always the weighted sum of the inputs, right? So if this would be j, then this is what comes in. And what goes out is that we apply an activation function."
1574.69,1603.31,"to this AJ, and then we get an output ZJ. And then it goes to the next layer. So this is focusing now on a single neuron. So we look at a single neuron. AJ is the weighted sum of the inputs. So the previous layer has produced outputs that are here indicated with ZI. So this would be Z1, Z2, Z3, ZI."
1603.31,1629.58,"until, let's say, some ZM or whatever. And then we look, what comes into this neuron is the weighted sum of all of these things. So what comes in here is depending on all of these previous neurons in a weighted sense. And then this comes in, and then we apply an activation function to this AJ, and then this comes out."
1629.71,1655.17,"And we are using this sigmoid function that we have also seen in logistic regression. And we need to have something like this because we need to have a surface that we know which way to walk down. If we would have functions like in my previous lecture that are very, let's say, binary, we cannot use this trick of gradient d descent. Yeah, so..."
1655.17,1684.06,"AJ goes in, that is the weighted sum, and then we apply the sigmoid function to AJ, and this is the expression that you have here. So this is the basic principle. So from now on, although there are many other possibilities that you could take, we always assume also, let's say at the exam at the end, that we are using the sigmoid function as our activation function."
1684.06,1714.67,"And why do we do that? Because it has nice mathematical properties that I will show you later. So remember that it looks like this. So it has this very, let's say, nice feature that numbers between minus infinity and plus infinity are always scaled to something between 0 and 1. So that's the property. And it's also a function where we always know what to do to walk down."
1714.67,1745.02,"I think you can also imagine we are looking for a global minimum, and then a function like this is also very good, right? That is like monotonously going down, right? That has all kinds of advantages. So as I said, there are other activation functions that you see here. So in the previous lecture, we were using this one just to explain logical things in terms of zero and ones, but this is not really working if you use gradient descent."
1745.02,1772.43,"you need to have something that looks like this. There are some other functions that could be applied. So again, and I'm repeating things so that it sets into your mind. So we are looking at the neuron. What comes in is the weighted sum. And what goes out is, let's say, this sigmoid function applied to the weighted sum. That's it, right? And I'm showing you here one neuron."
1772.43,1805.42,"And we will often reason from one neuron, but we have a whole network, right? This neuron could be in any layer. Yeah? What is our goal? So this is a single neuron. What is our overall goal is to minimize this error. So we are interested in a derivative of this error that is equal to zero. And we know in which way that we should walk down. Here I'm showing this that, of course, we should sum this over all instances Q."
1805.49,1834.8,"We do not have just a single training example, but millions of training examples. So we need to take the sum over millions of samples, and that's like I'm parameterizing here, let's say, y and t with this particular instance that we look at. Using the sum rule, we see that the derivative of this can be simply written as the sum of all the derivatives."
1834.8,1864.67,"And because that is the case, we now just assume that there is just a single instance. I dropped a subscript Q here. There is just a single instance. And we will come back to that topic at the end. So our goal is now to update this for a single instance. A notational point that I need to mention, I also did that in the last lecture, is that sometimes you see this constant B."
1864.67,1892.86,"For example, in the SVMs, we had this constant B. But you can think of this constant B as a weight W0 that is multiplied times an input 1. So in all of the neural networks, you will see, let's say, an arc coming in like this. It is labeled with W0 something. So every neuron has such a constant B."
1892.86,1921.74,"And that is simply represented as another weight. Right? To make notation simple. And you should think of this as there is another input neuron here that has always value 1. Right? We do 1 times this value and then it's exactly the same as all the other ones. Yeah? So when I write down this sum here, right, I'm not having a special case for this situation."
1921.87,1950.45,"I just assume that Z0 is equal to 1. And that's like it's a constant 1 and that's the trick. Okay, so I'm abusing notation a bit to not make you completely, let's say, mad. So what we often do is that we use indices to refer to things in a different layer. So here I say ZI and here I said ZJ."
